GVKEY,Company,Handle,Twitter_Descr,verified
140541,TAPESTRY INC,Coach,The original American house of leather.,True
141459,GARMIN LTD,Garmin,Engineered on the inside for life on the outside. Questions? Visit https://t.co/X8hmSwm2ec. For more visit us at https://t.co/8Vs2SYClHA or in person https://t.co/qdt7qb1g5s.,True
142460,PEABODY ENERGY CORP,peabodyenergy,"Peabody is the leading global pure-play coal company, serving power and steel customers in more than 25 countries on six continents.",True
144009,WILLIS TOWERS WATSON PLC,WTWesp,"Tú ves el futuro. Nosotros te ayudamos a llegar a él. Gestionamos #personas, #riesgos y #capital para convertirlos en oportunidades de crecimiento.",True
145046,ANTHEM INC,AnthemInc,Our companies work to bring affordable quality care to consumers. Follow us for the latest health care insights. Corp responsibility @AnthemFDN,True
145049,GAMESTOP CORP,gamestopcorp,Tweets from the @gamestop communications team with news from its family of specialty retail brands. Customer or product issues? Email us at twitter@gamestop.com,True
150937,SEAGATE TECHNOLOGY PLC,Seagate,The world leader in storage solutions. Pioneering the datasphere. For support @AskSeagate,True
158354,GENWORTH FINANCIAL INC,Genworth,Helping families have “the talk” about long term care planning. Need us? Call 888-GENWORTH.,True
160479,EXTRA SPACE STORAGE INC,extraspace,Life transitions are difficult. We make them easier.,True
160991,DIGITAL REALTY TRUST INC,DigitalAPAC,Leading provider of data centre solutions in Asia Pacific and around the globe.  https://t.co/14nLpiX5G4,True
162129,MOSAIC CO,SuttonBStracke,Mom of 3. Art & fashion lover. Official Cast member of #RHOBH @bravotv. press opportunities please contact tad@mosaic https://t.co/l7kT9vL6Zt or jenn@mosaicpr.com,True
164708,AMERIPRISE FINANCIAL INC,ameriprise,"As a leader in financial planning, Ameriprise Financial, LLC. has helped millions of clients achieve their financial goals for more than 120 years.",True
174490,WINDSTREAM HOLDINGS INC,Windstream,Windstream is an innovative communications & software company offering managed communications services to businesses and high-speed internet to consumers,True
174729,WYNDHAM DESTINATIONS INC,wyndestinations,We believe in putting the world on #vacation. We believe in finding your perfect place. We believe in hospitality with heart. Our world is your #destination.,True
177376,DISCOVER FINANCIAL SVCS,Discover,"Thanks to your #EatItForward nominations, Discover is giving Black-owned restaurants a total of $5 million this year! See our winners so far in the link below.",True
178507,MSCI INC,MSCI_Inc,"An independent provider of research-driven insights, tools & #indices for investors, based on over 50 years’ academic research & real-world experience.",True
178704,ULTA BEAUTY INC,ultabeauty,The Possibilities Are Beautiful.✨,True
179437,AMERICAN WATER WORKS CO INC,amwater,We Keep Life Flowing,True
179700,DR PEPPER SNAPPLE GROUP INC,DrPepperSnapple,Serving up flavorful tweets from Dr Pepper Snapple Group.,True
183377,FORTINET INC,Fortinet,"The Fortinet #SecurityFabric platform secures the largest enterprise, service provider, and government organizations around the world.",True
184500,CBOE GLOBAL MARKETS INC,BatsGlobal,This account is closed. We're now powering your potential as @Cboe,True
186989,MARATHON PETROLEUM CORP,MarathonPetroCo,Marathon Petroleum Corporation (MPC) 2020 'ENERGY STAR Partner of the Year' -EPA,True
199356,TRIPADVISOR INC,TripAdvisor,Find the good out there. #TheresGoodOutThere,True
